{"$schema":"https://github.com/onovich/Game-Primitives/blob/main/research/calibration-tests/continuous-action-pilot/schema/role-submission-0.1.1.schema.json","artifact_type":"reconstruction_submission","artifact_version":"0.1.1","run_id":"rehearsal-004","condition_id":"condition-v02","stage":"reconstruction","submission_id":"submission.reconstruct.v02.r4","task_id":"task.reconstruct.v02","submitted_at":"2026-07-26T18:44:00Z","first_submission":true,"prior_stage_submission_sha256":null,"actor":{"identifier":"blind4-v02-r4","model":"Codex delegated agent","model_version":"current-thread-runtime","reasoning_effort":"xhigh","role":"blind_reconstructor_predictor","session_id":"rehearsal-004-condition-v02-r4"},"input_artifacts":[{"artifact_id":"view-v02","sha256":"c47d624206d5bf4effa0b575f3ddc0bff7c8954256b9fe210e60f33488d53f27"}],"pollution":{"familiarity":{"exact_result_knowledge":"none","exact_rule_knowledge":"none","exact_variant_knowledge":"none","project_exposure":"none","related_genre_experience":"none","recognized_family":null,"recognized_work":null,"recognition_status":"none"},"integrity_exposures":[],"stage_update_note":null},"reconstruction_answers":[{"case_id":"CA-R2","confidence_percent":95,"uniqueness":"multiple_compatible_structures","recovered_facts":[{"fact_id":"initial-total","claim":"初始 state.total 为 0。","recovery_status":"recovered","supporting_record_ids":["view-v02"]},{"fact_id":"step1-raw-input","claim":"步骤1的原始输入为2。","recovery_status":"recovered","supporting_record_ids":["view-v02"]},{"fact_id":"step2-raw-input","claim":"步骤2的原始输入为5。","recovery_status":"recovered","supporting_record_ids":["view-v02"]},{"fact_id":"vq-visible-values","claim":"证据给出 v-q 的活动值为0以及允许值0/1。","recovery_status":"recovered","supporting_record_ids":["view-v02"]},{"fact_id":"step1-operation","claim":"步骤1发生一次 op.accumulate，且该操作写入 state.total。","recovery_status":"recovered","supporting_record_ids":["view-v02"]},{"fact_id":"step2-operation","claim":"步骤2发生一次 op.accumulate，且该操作写入 state.total。","recovery_status":"recovered","supporting_record_ids":["view-v02"]},{"fact_id":"post-step2-observation","claim":"步骤2之后观察了 state.total。","recovery_status":"recovered","supporting_record_ids":["view-v02"]},{"fact_id":"update-rule-gap","claim":"无法恢复 op.accumulate 写入 state.total 时使用的具体更新公式；操作名称本身不证明执行加法。","recovery_status":"not_recoverable","supporting_record_ids":["view-v02"]},{"fact_id":"input-read-gap","claim":"无法恢复两步原始输入是否被 op.accumulate 读取或如何参与更新。","recovery_status":"not_recoverable","supporting_record_ids":["view-v02"]},{"fact_id":"vq-relation-gap","claim":"无法恢复 v-q 的活动值或允许值与操作发生、输入读取或 state.total 更新之间的关系。","recovery_status":"not_recoverable","supporting_record_ids":["view-v02"]},{"fact_id":"same-step-order-gap","claim":"无法恢复同一步内 v-q 状态、原始输入、op.accumulate 和写入 state.total 的先后关系。","recovery_status":"not_recoverable","supporting_record_ids":["view-v02"]},{"fact_id":"final-total-gap","claim":"无法唯一恢复步骤2后所观察到的 state.total 数值。","recovery_status":"not_recoverable","supporting_record_ids":["view-v02"]}],"compatible_branches":[{"branch_id":"branch-overwrite-input","description":"一种相容结构是假设每次 op.accumulate 在写入前读取该步原始输入，并令 state.total 等于该输入，且 v-q 不参与更新；步骤1后 total=2，步骤2后停止值为5。","supporting_record_ids":["view-v02"]},{"branch_id":"branch-add-input","description":"另一种相容结构是假设每次 op.accumulate 在写入前读取旧 total 和该步原始输入，并令新 total 等于二者之和，且 v-q 不参与更新；步骤1后 total=2，步骤2后停止值为7。此加法仅是分支假设，不是从操作名称恢复的事实。","supporting_record_ids":["view-v02"]}],"assumptions":["两个分支分别加入不同且互斥的更新规则，仅用于展示现有证据不能确定唯一结构或停止值。"],"ambiguities":["op.accumulate 的更新公式未知，名称不构成加法证据。","原始输入是否被读取及其读取时点未知。","v-q 的活动值和允许值如何影响操作、读取或写入未知。","同一步内各记录之间的顺序关系未知。","因此步骤2后的 state.total 停止值可能因相容结构而不同。"]}],"prediction_answers":[],"audit_checks":[],"audit_decision":null,"findings":[]}
