{"$schema":"https://github.com/onovich/Game-Primitives/blob/main/research/calibration-tests/continuous-action-pilot/schema/role-submission-0.1.1.schema.json","artifact_type":"reconstruction_submission","artifact_version":"0.1.1","run_id":"rehearsal-004","condition_id":"condition-v02","stage":"reconstruction","submission_id":"submission.reconstruct.v02.r6","task_id":"task.reconstruct.v02","submitted_at":"2026-07-26T18:50:00Z","first_submission":true,"prior_stage_submission_sha256":null,"actor":{"identifier":"blind4-v02-r6","model":"Codex delegated agent","model_version":"current-thread-runtime","reasoning_effort":"xhigh","role":"blind_reconstructor_predictor","session_id":"rehearsal-004-condition-v02-r6"},"input_artifacts":[{"artifact_id":"view-v02","sha256":"c47d624206d5bf4effa0b575f3ddc0bff7c8954256b9fe210e60f33488d53f27"}],"pollution":{"familiarity":{"exact_result_knowledge":"none","exact_rule_knowledge":"none","exact_variant_knowledge":"none","project_exposure":"none","related_genre_experience":"none","recognized_family":null,"recognized_work":null,"recognition_status":"none"},"integrity_exposures":[],"stage_update_note":null},"reconstruction_answers":[{"case_id":"CA-R2","confidence_percent":95,"uniqueness":"multiple_compatible_structures","recovered_facts":[{"fact_id":"initial-total","claim":"初始 total 为0。","recovery_status":"recovered","supporting_record_ids":["view-v02"]},{"fact_id":"step-one-observations","claim":"步骤1的原始输入为2，v-q 活动值为0，允许值为0。","recovery_status":"recovered","supporting_record_ids":["view-v02"]},{"fact_id":"step-two-observations","claim":"步骤2的原始输入为5，v-q 活动值为0，允许值为1。","recovery_status":"recovered","supporting_record_ids":["view-v02"]},{"fact_id":"operation-count","claim":"两个步骤各发生一次 op.accumulate。","recovery_status":"recovered","supporting_record_ids":["view-v02"]},{"fact_id":"write-events","claim":"每次 op.accumulate 都写入 total。","recovery_status":"recovered","supporting_record_ids":["view-v02"]},{"fact_id":"observation-point","claim":"在步骤2完成后观察 total。","recovery_status":"recovered","supporting_record_ids":["view-v02"]},{"fact_id":"update-gap","claim":"无法恢复 total 的更新公式；op.accumulate 的名称不足以证明其执行加法。","recovery_status":"not_recoverable","supporting_record_ids":["view-v02"]},{"fact_id":"input-role-gap","claim":"无法恢复原始输入、v-q 活动值和允许值在更新中的作用。","recovery_status":"not_recoverable","supporting_record_ids":["view-v02"]},{"fact_id":"ordering-gap","claim":"无法恢复配置、读取与更新之间的顺序关系。","recovery_status":"not_recoverable","supporting_record_ids":["view-v02"]},{"fact_id":"final-total-gap","claim":"无法唯一恢复步骤2后观察到的 total 值。","recovery_status":"not_recoverable","supporting_record_ids":["view-v02"]}],"compatible_branches":[{"branch_id":"branch-one","description":"相容结构之一是每次令 total 等于此前 total 与本步原始输入之和；该加法规则仅是假设而非由名称推出，步骤2后的停止值为7。","supporting_record_ids":["view-v02"]},{"branch_id":"branch-two","description":"另一相容结构是每次令 total 等于本步原始输入；步骤2后的停止值为5。","supporting_record_ids":["view-v02"]},{"branch_id":"branch-three","description":"另一相容结构是每次写回此前的 total，不改变其数值；步骤2后的停止值为0。","supporting_record_ids":["view-v02"]},{"branch_id":"branch-four","description":"另一相容结构是仅在允许值为1时把本步原始输入加入 total；步骤1不增加、步骤2增加5，停止值为5。","supporting_record_ids":["view-v02"]}],"assumptions":[],"ambiguities":["更新关系未声明。","op.accumulate 的名称不能作为加法语义的证据。","原始输入、v-q 活动值和允许值是否参与更新以及如何参与均不明确。","写入 total 不等于证明 total 的数值发生变化。","配置、读取与更新之间的先后顺序未声明。","步骤2后的 total 观察值无法由公开证据唯一确定。"]}],"prediction_answers":[],"audit_checks":[],"audit_decision":null,"findings":[]}
