{"$schema":"https://github.com/onovich/Game-Primitives/blob/main/research/calibration-tests/continuous-action-pilot/schema/role-submission-0.1.1.schema.json","artifact_type":"prediction_submission","artifact_version":"0.1.1","run_id":"rehearsal-004","condition_id":"condition-v01","stage":"prediction","submission_id":"submission.predict.v01.r2","task_id":"task.predict.neutral","submitted_at":"2026-07-26T18:46:00Z","first_submission":true,"prior_stage_submission_sha256":"2ed31828f4c96acdc2616e1aaf87ab6b07906ce6e22940b397320894ed123ef5","actor":{"identifier":"blind4-v01-r2","model":"Codex delegated agent","model_version":"current-thread-runtime","reasoning_effort":"xhigh","role":"blind_reconstructor_predictor","session_id":"rehearsal-004-condition-v01-r2"},"input_artifacts":[{"artifact_id":"variant-envelope","sha256":"1ca9239b3b38a06adacb1c6bd8dffb51d86eb480eef76fc1b2099da5af4ed4c4"},{"artifact_id":"submission.reconstruct.v01.r2","sha256":"2ed31828f4c96acdc2616e1aaf87ab6b07906ce6e22940b397320894ed123ef5"}],"pollution":{"familiarity":{"exact_result_knowledge":"none","exact_rule_knowledge":"none","exact_variant_knowledge":"none","project_exposure":"none","related_genre_experience":"none","recognized_family":null,"recognized_work":null,"recognition_status":"none"},"integrity_exposures":[],"stage_update_note":"只收到中立变体信封与我自己的第一阶段提交散列，未收到其他条件或真值。"},"reconstruction_answers":[],"prediction_answers":[{"case_id":"CA-R2","confidence_percent":100,"prediction_status":"determinate","expectations":[{"configuration_id":"config.baseline","expectation_kind":"exact","observation_id":"obs.total-at-stop","tolerance_rule_id":null,"value":{"serialized_value":"7","unit":"integer","value_type":"integer"}},{"configuration_id":"config.variant","expectation_kind":"exact","observation_id":"obs.total-at-stop","tolerance_rule_id":null,"value":{"serialized_value":"4","unit":"integer","value_type":"integer"}}],"compatible_alternatives":[],"reasoning":"基线 v-q=0 在两次更新开始时分别读取当前步骤输入2和5，累计结果为7。变体 v-q=1 在片段入口读取第一步输入2，并在两次更新中复用，因此累计结果为4。停止观察均发生在步骤2完成之后。","supporting_record_ids":["rec.sampling-policy","rec.accumulator-process","rec.step-order"],"assumptions":[]}],"audit_checks":[],"audit_decision":null,"findings":[]}
