{"$schema":"https://github.com/onovich/Game-Primitives/blob/main/research/calibration-tests/continuous-action-pilot/schema/role-submission-0.1.1.schema.json","artifact_type":"reconstruction_submission","artifact_version":"0.1.1","run_id":"rehearsal-002","condition_id":"condition-v01","stage":"reconstruction","submission_id":"submission.reconstruct.v01.r1","task_id":"task.reconstruct.v01","submitted_at":"2026-07-26T18:17:00Z","first_submission":true,"prior_stage_submission_sha256":null,"actor":{"identifier":"blind2-v01-r1","model":"Codex delegated agent","model_version":"current-thread-runtime","reasoning_effort":"xhigh","role":"blind_reconstructor_predictor","session_id":"rehearsal-002-condition-v01-r1"},"input_artifacts":[{"artifact_id":"view-v01","sha256":"020e6458e93cbe9904bac0968bc96c3f4aef2472767a4af101360571995ab1b8"}],"pollution":{"familiarity":{"exact_result_knowledge":"none","exact_rule_knowledge":"none","exact_variant_knowledge":"none","project_exposure":"none","recognized_family":null,"recognized_work":null,"recognition_status":"none","related_genre_experience":"none"},"integrity_exposures":[],"stage_update_note":null},"reconstruction_answers":[{"case_id":"CA-R2","confidence_percent":99,"uniqueness":"multiple_compatible_structures","recovered_facts":[{"fact_id":"initial-total-zero","claim":"状态字段 state.total 的初始值为 0。","recovery_status":"recovered","supporting_record_ids":["state.total"]},{"fact_id":"two-ordered-steps","claim":"过程使用离散时间基，并按步骤 1、步骤 2 的顺序执行。","recovery_status":"recovered","supporting_record_ids":["time.discrete-step"]},{"fact_id":"active-configuration-zero","claim":"不透明配置变量 v-q 的活动值为 0，允许值为 0 或 1。","recovery_status":"recovered","supporting_record_ids":["v-q"]},{"fact_id":"sample-current-input-per-update","claim":"活动配置要求在每次状态更新开始时读取当前步骤的原始输入，并将其作为 value.sampled。","recovery_status":"recovered","supporting_record_ids":["rec.sampling-policy","value.sampled","v-q"]},{"fact_id":"accumulate-sampled-value","claim":"每次更新均执行 state.total := state.total + value.sampled，并写回 state.total。","recovery_status":"recovered","supporting_record_ids":["rec.accumulator-process","state.total","value.sampled"]},{"fact_id":"read-before-update","claim":"每个步骤内先读取 value.sampled，随后执行 state.total 更新。","recovery_status":"recovered","supporting_record_ids":["rec.step-order","value.sampled","state.total"]},{"fact_id":"accumulate-on-both-steps","claim":"步骤 1 和步骤 2 各执行一次引用相同采样、累加和步骤内顺序记录的 op.accumulate 操作。","recovery_status":"recovered","supporting_record_ids":["op.accumulate","rec.sampling-policy","rec.accumulator-process","rec.step-order","time.discrete-step"]},{"fact_id":"observe-total-after-step-two","claim":"停止边界 stop.after-step-2 到达时，通过 obs.total-at-stop 读取 state.total。","recovery_status":"recovered","supporting_record_ids":["obs.total-at-stop","stop.after-step-2","state.total"]},{"fact_id":"source-form-underdetermined","claim":"无法从视图恢复该操作语义所采用的具体源码控制结构、函数边界或语句展开形式。","recovery_status":"not_recoverable","supporting_record_ids":["op.accumulate","rec.sampling-policy","rec.accumulator-process","rec.step-order"]}],"compatible_branches":[{"branch_id":"loop-with-inline-read","description":"使用按步骤迭代的循环，在每轮开头内联读取当前步骤输入，然后累加到 state.total。","supporting_record_ids":["rec.sampling-policy","rec.accumulator-process","rec.step-order","op.accumulate"]},{"branch_id":"loop-with-sampling-helper","description":"使用按步骤迭代的循环，通过辅助过程在每轮更新开始时取得当前步骤输入，再由独立累加过程更新 state.total。","supporting_record_ids":["rec.sampling-policy","rec.accumulator-process","rec.step-order","op.accumulate"]},{"branch_id":"ordered-unrolled-updates","description":"将两个步骤展开为两段有序更新，每段都在更新开始时读取对应步骤的当前输入后累加。","supporting_record_ids":["time.discrete-step","rec.sampling-policy","rec.accumulator-process","rec.step-order","op.accumulate"]}],"assumptions":["兼容性按视图公开的读取时机、状态更新规则、执行顺序和停止观察边界判断，不要求源码文本或模块划分相同。"],"ambiguities":["具体实现使用循环、展开语句还是辅助函数不可确定。","state.total 与 value.sampled 的数值类型、溢出规则及视图之外的副作用未给出。","停止边界之后的状态生命周期与是否重置未给出。"]}],"prediction_answers":[],"audit_checks":[],"audit_decision":null,"findings":[]}
