{"$schema":"https://github.com/onovich/Game-Primitives/blob/main/research/calibration-tests/continuous-action-pilot/schema/role-submission-0.1.1.schema.json","artifact_type":"prediction_submission","artifact_version":"0.1.1","run_id":"rehearsal-002","condition_id":"condition-v02","stage":"prediction","submission_id":"submission.predict.v02.r2","task_id":"task.predict.neutral","submitted_at":"2026-07-26T18:21:00Z","first_submission":true,"prior_stage_submission_sha256":"44c9fe248cda668f7d1f2f7a33684407ced3bc332972fb11bbddf77c7accd93f","actor":{"identifier":"blind2-v02-r2","model":"Codex delegated agent","model_version":"current-thread-runtime","reasoning_effort":"xhigh","role":"blind_reconstructor_predictor","session_id":"rehearsal-002-condition-v02-r2"},"input_artifacts":[{"artifact_id":"variant-envelope","sha256":"edee576a30644e08fe3f22cd17ff981454d29a56fa19807bf8b3289d7d4c428e"},{"artifact_id":"submission.reconstruct.v02.r2","sha256":"44c9fe248cda668f7d1f2f7a33684407ced3bc332972fb11bbddf77c7accd93f"}],"pollution":{"familiarity":{"exact_result_knowledge":"none","exact_rule_knowledge":"none","exact_variant_knowledge":"none","project_exposure":"none","recognized_family":null,"recognized_work":null,"recognition_status":"none","related_genre_experience":"none"},"integrity_exposures":[],"stage_update_note":"仅收到冻结的中立变体信封和自己的重构散列。"},"reconstruction_answers":[],"prediction_answers":[{"case_id":"CA-R2","confidence_percent":99,"prediction_status":"indeterminate","expectations":[{"configuration_id":"config.baseline","expectation_kind":"status","observation_id":"obs.total-at-stop","tolerance_rule_id":null,"value":{"serialized_value":"indeterminate","unit":null,"value_type":"status"}},{"configuration_id":"config.variant","expectation_kind":"status","observation_id":"obs.total-at-stop","tolerance_rule_id":null,"value":{"serialized_value":"indeterminate","unit":null,"value_type":"status"}}],"compatible_alternatives":[{"alternative_id":"direct-addition","description":"op.accumulate 在每一步执行 state.total := state.total + raw_value，而 v-q 不参与更新。","expectations":[{"configuration_id":"config.baseline","expectation_kind":"exact","observation_id":"obs.total-at-stop","tolerance_rule_id":null,"value":{"serialized_value":"7","unit":"integer","value_type":"integer"}},{"configuration_id":"config.variant","expectation_kind":"exact","observation_id":"obs.total-at-stop","tolerance_rule_id":null,"value":{"serialized_value":"7","unit":"integer","value_type":"integer"}}]},{"alternative_id":"configuration-multiplier","description":"op.accumulate 在每一步执行 state.total := state.total + raw_value × v-q。","expectations":[{"configuration_id":"config.baseline","expectation_kind":"exact","observation_id":"obs.total-at-stop","tolerance_rule_id":null,"value":{"serialized_value":"0","unit":"integer","value_type":"integer"}},{"configuration_id":"config.variant","expectation_kind":"exact","observation_id":"obs.total-at-stop","tolerance_rule_id":null,"value":{"serialized_value":"7","unit":"integer","value_type":"integer"}}]}],"reasoning":"视图只声明两次操作写入 state.total，未声明原始输入、v-q 与更新公式之间的关系。中立信封仅将 v-q 从 0 干预为 1，并保持其余结构不变。因此，忽略 v-q 的直接加法结构与使用 v-q 作为乘数的结构都符合全部已知记录，却分别产生不同的基线—变体数值对，停止值不能唯一决定。","supporting_record_ids":["state.total","v-q","op.accumulate","obs.total-at-stop","stop.after-step-2","view-v02"],"assumptions":["初始状态、输入序列、两次操作及其顺序在基线与变体之间保持不变。","operation_id 中的 accumulate 不足以唯一规定加法语义。","写入 state.total 可以包含写回未变化的数值。"]}],"audit_checks":[],"audit_decision":null,"findings":[]}
