{"$schema":"https://github.com/onovich/Game-Primitives/blob/main/research/calibration-tests/continuous-action-pilot/schema/role-submission-0.1.1.schema.json","artifact_type":"prediction_submission","artifact_version":"0.1.1","run_id":"rehearsal-002","condition_id":"condition-v01","stage":"prediction","submission_id":"submission.predict.v01.r1","task_id":"task.predict.neutral","submitted_at":"2026-07-26T18:21:00Z","first_submission":true,"prior_stage_submission_sha256":"65ea72da1be2cbae2dc3e9ade0ad8fa5eb73695c1aaa2db00c56e31d1e2c045e","actor":{"identifier":"blind2-v01-r1","model":"Codex delegated agent","model_version":"current-thread-runtime","reasoning_effort":"xhigh","role":"blind_reconstructor_predictor","session_id":"rehearsal-002-condition-v01-r1"},"input_artifacts":[{"artifact_id":"variant-envelope","sha256":"edee576a30644e08fe3f22cd17ff981454d29a56fa19807bf8b3289d7d4c428e"},{"artifact_id":"submission.reconstruct.v01.r1","sha256":"65ea72da1be2cbae2dc3e9ade0ad8fa5eb73695c1aaa2db00c56e31d1e2c045e"}],"pollution":{"familiarity":{"exact_result_knowledge":"none","exact_rule_knowledge":"none","exact_variant_knowledge":"none","project_exposure":"none","recognized_family":null,"recognized_work":null,"recognition_status":"none","related_genre_experience":"none"},"integrity_exposures":[],"stage_update_note":"仅收到冻结的中立变体信封和自己的重构散列。"},"reconstruction_answers":[],"prediction_answers":[{"case_id":"CA-R2","confidence_percent":100,"prediction_status":"determinate","expectations":[{"configuration_id":"config.baseline","expectation_kind":"exact","observation_id":"obs.total-at-stop","tolerance_rule_id":null,"value":{"serialized_value":"7","unit":"integer","value_type":"integer"}},{"configuration_id":"config.variant","expectation_kind":"exact","observation_id":"obs.total-at-stop","tolerance_rule_id":null,"value":{"serialized_value":"4","unit":"integer","value_type":"integer"}}],"compatible_alternatives":[],"reasoning":"基线配置值 0 在两次更新开始时分别读取当前步骤原始输入 2 和 5，因此停止值为 0+2+5=7。变体配置值 1 在片段入口读取第一步原始输入 2，并在两次更新中复用该值，因此停止值为 0+2+2=4。","supporting_record_ids":["v-q","rec.sampling-policy","value.sampled","rec.accumulator-process","rec.step-order","state.total","time.discrete-step","obs.total-at-stop","stop.after-step-2"],"assumptions":["按中立信封所列不变量，仅将 v-q 从基线值 0 干预为变体值 1，其余初始状态、输入轨迹、操作次数、操作身份、步骤顺序、输出契约和停止边界均保持不变。"]}],"audit_checks":[],"audit_decision":null,"findings":[]}
