{"$schema":"https://github.com/onovich/Game-Primitives/blob/main/research/calibration-tests/continuous-action-pilot/schema/role-submission-0.1.1.schema.json","artifact_type":"reconstruction_submission","artifact_version":"0.1.1","run_id":"rehearsal-004","condition_id":"condition-v02","stage":"reconstruction","submission_id":"submission.reconstruct.v02.r8","task_id":"task.reconstruct.v02","submitted_at":"2026-07-26T18:58:00Z","first_submission":true,"prior_stage_submission_sha256":null,"actor":{"identifier":"blind4-v02-r8","model":"Codex delegated agent","model_version":"current-thread-runtime","reasoning_effort":"xhigh","role":"blind_reconstructor_predictor","session_id":"rehearsal-004-condition-v02-r8"},"input_artifacts":[{"artifact_id":"view-v02","sha256":"c47d624206d5bf4effa0b575f3ddc0bff7c8954256b9fe210e60f33488d53f27"}],"pollution":{"familiarity":{"exact_result_knowledge":"none","exact_rule_knowledge":"none","exact_variant_knowledge":"none","project_exposure":"none","related_genre_experience":"none","recognized_family":null,"recognized_work":null,"recognition_status":"none"},"integrity_exposures":[],"stage_update_note":null},"reconstruction_answers":[{"case_id":"CA-R2","confidence_percent":95,"uniqueness":"multiple_compatible_structures","recovered_facts":[{"fact_id":"initial-total","claim":"初始 total 为0。","recovery_status":"recovered","supporting_record_ids":["view-v02"]},{"fact_id":"update-gap","claim":"更新公式不可恢复。","recovery_status":"not_recoverable","supporting_record_ids":["view-v02"]}],"compatible_branches":[{"branch_id":"branch-add","description":"逐步相加可产生停止值7。","supporting_record_ids":["view-v02"]},{"branch_id":"branch-replace","description":"逐步覆盖可产生停止值5。","supporting_record_ids":["view-v02"]}],"assumptions":[],"ambiguities":["多种更新结构与视图相容。"]}],"prediction_answers":[],"audit_checks":[],"audit_decision":null,"findings":[]}
