{"$schema":"https://github.com/onovich/Game-Primitives/blob/main/research/calibration-tests/continuous-action-pilot/schema/role-submission-0.1.1.schema.json","artifact_type":"reconstruction_submission","artifact_version":"0.1.1","run_id":"rehearsal-002","condition_id":"condition-v02","stage":"reconstruction","submission_id":"submission.reconstruct.v02.r2","task_id":"task.reconstruct.v02","submitted_at":"2026-07-26T18:19:00Z","first_submission":true,"prior_stage_submission_sha256":null,"actor":{"identifier":"blind2-v02-r2","model":"Codex delegated agent","model_version":"current-thread-runtime","reasoning_effort":"xhigh","role":"blind_reconstructor_predictor","session_id":"rehearsal-002-condition-v02-r2"},"input_artifacts":[{"artifact_id":"view-v02","sha256":"d38db6f5cabb9e23661f43c1a16127de6cfaf767cfcf3921a95f3353b8c7d4b1"}],"pollution":{"familiarity":{"exact_result_knowledge":"none","exact_rule_knowledge":"none","exact_variant_knowledge":"none","project_exposure":"none","recognized_family":null,"recognized_work":null,"recognition_status":"none","related_genre_experience":"none"},"integrity_exposures":[],"stage_update_note":null},"reconstruction_answers":[{"case_id":"CA-R2","confidence_percent":98,"uniqueness":"multiple_compatible_structures","recovered_facts":[{"fact_id":"initial-total","claim":"state.total 的初始值为 0。","recovery_status":"recovered","supporting_record_ids":["state.total","view-v02"]},{"fact_id":"input-sequence","claim":"两个步骤的原始输入依次为 2 和 5。","recovery_status":"recovered","supporting_record_ids":["view-v02"]},{"fact_id":"configuration","claim":"配置变量 v-q 的活动值为 0，允许值为 0 和 1。","recovery_status":"recovered","supporting_record_ids":["v-q","view-v02"]},{"fact_id":"operation-writes","claim":"op.accumulate 在两个步骤中发生，并均写入 state.total。","recovery_status":"recovered","supporting_record_ids":["op.accumulate","state.total","view-v02"]},{"fact_id":"stop-observation","claim":"obs.total-at-stop 在第二步之后的停止边界读取 state.total。","recovery_status":"recovered","supporting_record_ids":["obs.total-at-stop","stop.after-step-2","state.total","view-v02"]},{"fact_id":"update-relation","claim":"v-q、原始输入与 state.total 更新之间的具体关系无法从该视图恢复。","recovery_status":"not_recoverable","supporting_record_ids":["v-q","op.accumulate","state.total","view-v02"]},{"fact_id":"terminal-total","claim":"停止边界处 state.total 的具体值无法仅由已声明结构唯一确定。","recovery_status":"not_recoverable","supporting_record_ids":["state.total","op.accumulate","obs.total-at-stop","stop.after-step-2","view-v02"]}],"compatible_branches":[{"branch_id":"direct-addition","description":"op.accumulate 可将每步原始输入直接加到 state.total，且 v-q 在本次运行中不影响更新。","supporting_record_ids":["op.accumulate","state.total","v-q","view-v02"]},{"branch_id":"configuration-gate","description":"v-q 可充当更新门控；活动值 0 可阻止、允许或改变 op.accumulate 对 state.total 的写入。","supporting_record_ids":["v-q","op.accumulate","state.total","view-v02"]},{"branch_id":"configuration-selected-rule","description":"v-q 的值 0 可选择某个未公开的更新规则，例如替换、减法或其他变换，而非直接相加。","supporting_record_ids":["v-q","op.accumulate","state.total","view-v02"]}],"assumptions":["将视图中的字段和值视为内部一致且完整记录的已声明结构。","不依据 operation_id 中的 accumulate 一词推断算术加法语义。","不把 writes 解释为已公开具体更新公式。"],"ambiguities":["未声明 op.accumulate 是否读取原始输入。","未声明 v-q 是否参与更新以及活动值 0 的语义。","未声明每次写入是加法、替换、条件更新还是其他状态变换。","未提供各步骤写入后的中间状态或停止边界处的观测值。"]}],"prediction_answers":[],"audit_checks":[],"audit_decision":null,"findings":[]}
